{"id":"2026-08-28","title":"Wydanie 2026-08-28","teaser":"28 tys. dolar\u00F3w na tokeny w 28 dni, 124 raporty z nieistniej\u0105cego think tanku i watermark odporny na parafraz\u0119 \u2014 AI coraz lepiej mierzy, znakuje i produkuje tre\u015B\u0107, tylko kto jeszcze sprawdza jej sens?","generatedAt":"2026-08-29T19:13:39.4427854+00:00","items":[{"position":28,"redditPostId":"83341243-6474-4d24-9dcf-cdd917ec1d26","title":"Claude zostawi niewidoczny \u015Blad w pracy i na zaj\u0119ciach","description":"Anthropic wprowadza niewidoczne watermarki, by spe\u0142ni\u0107 wymogi EU AI Act. Statystyczny \u015Blad mo\u017Ce przetrwa\u0107 nawet parafraz\u0119 wykonan\u0105 przez inny model, wi\u0119c tekst oddany w pracy lub na uczelni nadal mo\u017Ce zdradza\u0107 u\u017Cycie AI.","redditUrl":"/r/technology/comments/1vmtw7h/some_claude_users_are_mad_that_anthropics_new/","resourceUrl":"https://techcrunch.com/2026/08/12/some-claude-users-are-mad-that-anthropics-new-watermarks-will-catch-them-cheating-at-their-jobs-classes/","subreddit":"technology"},{"position":35,"redditPostId":"55254a9b-da7e-4fa4-ab54-0683254512d4","title":"USA pozwol\u0105 prywatnym firmom niszczy\u0107 systemy za granic\u0105","description":"Na celowniku maj\u0105 by\u0107 zagraniczne grupy cyberprzest\u0119pcze, w tym grupy ransomware dzia\u0142aj\u0105ce za cichym przyzwoleniem pa\u0144stwa. Ka\u017Cda operacja wymaga pisemnej zgody dw\u00F3ch resort\u00F3w oraz kaucji w wysoko\u015Bci co najmniej miliona dolar\u00F3w. Nie mo\u017Cna zatwierdza\u0107 dzia\u0142a\u0144 gro\u017C\u0105cych \u015Bmierci\u0105 lub uznaniem za atak zbrojny.","redditUrl":"/r/technology/comments/1vp2xvc/white_house_authorizes_private_companies_to/","resourceUrl":"https://www.tomshardware.com/tech-industry/cyber-security/white-house-authorizes-private-companies-to-hack-foreign-cybercrime-groups","subreddit":"technology"},{"position":42,"redditPostId":"adc23f65-8a92-4b9d-be50-e85c7d7eb693","title":"GoldenEye 007 zdekompilowane w 100%. Na port trzeba poczeka\u0107","description":"Dekompilacja otwiera drog\u0119 do zaawansowanych mod\u00F3w i port\u00F3w na inne systemy. Port gry na PC ju\u017C powstaje, ale uko\u0144czenie dekompilacji nie oznacza gotowej wersji na komputery.","redditUrl":"/r/technology/comments/1vr9h6k/goldeneye_007_for_n64_has_been_100_decompiled/","resourceUrl":"https://www.tomshardware.com/video-games/retro-gaming/goldeneye-007-for-n64-has-been-100-percent-decompiled-success-of-half-decade-project-opens-up-possibilities-for-complex-mods-and-ports","subreddit":"technology"},{"position":44,"redditPostId":"178bc66b-971a-4254-8a97-3820a65df393","title":"600 przejazd\u00F3w za 30 juan\u00F3w. Regulatorzy m\u00F3wi\u0105: stop","description":"Chi\u0144scy regulatorzy uznali op\u0142aty za niesprawiedliwe wobec senior\u00F3w i os\u00F3b z ograniczeniami ruchowymi. Mikrop\u0142atno\u015Bci mia\u0142y finansowa\u0107 utrzymanie infrastruktury, a podobny model obejmuje ju\u017C szafki paczkowe, \u015Bwiat\u0142o na klatkach i ogrzewanie. W Gruzji przejazd kosztuje 5\u201310 tetri, a w Neapolu pobierano 20 cent\u00F3w.","redditUrl":"/r/technology/comments/1vujxju/coinoperated_elevators_in_condominiums_and/","resourceUrl":"https://www.gadgetreview.com/coin-operated-elevators-in-condominiums-and-apartment-buildings-are-becoming-more-common","subreddit":"technology"},{"position":45,"redditPostId":"1517494b-b7f2-4555-a759-5082c445e403","title":"Pierwsza kamera internetowa powsta\u0142a przez dzbanek z kaw\u0105","description":"Od 1991 roku pracownicy Cambridge zdalnie sprawdzali, czy warto schodzi\u0107 po schodach. Obraz 128\u00D7128 pikseli od\u015Bwie\u017Ca\u0142 si\u0119 trzy razy na minut\u0119, a do internetu trafi\u0142 w listopadzie 1993 roku. Kamer\u0119 wy\u0142\u0105czono 22 sierpnia 2001 roku po dekadzie pracy.","redditUrl":"/r/technology/comments/1vw5z7b/the_worlds_first_webcam_was_switched_off_25_years/","resourceUrl":"https://www.tomshardware.com/peripherals/webcams/the-worlds-first-webcam-was-switched-off-25-years-ago-today-128x128-grayscale-feed-predated-the-world-wide-web-to-monitor-a-cambridge-coffee-pot","subreddit":"technology"},{"position":46,"redditPostId":"30e6eb98-39c7-4045-b5dc-6507154a8c84","title":"Hermes nie daje skompromitowanej stronie terminala","description":"Dedykowany profil web-search nie mo\u017Ce zapisywa\u0107 ani usuwa\u0107 plik\u00F3w, u\u017Cywa\u0107 gita ani terminala. Przegl\u0105danie dzia\u0142a w sandboxowanych sesjach Camofox, a g\u0142\u00F3wny profil nie ma narz\u0119dzi webowych. Zapytania trafiaj\u0105 do izolowanego profilu przez HERMES_PROFILE=web-search.","redditUrl":"/r/hermesagent/comments/1vx5zy5/how_i_isolated_web_search_from_the_rest_of_hermes/","resourceUrl":null,"subreddit":"hermesagent"},{"position":49,"redditPostId":"46d5a3a8-dce5-4aee-85ce-af6b910582c1","title":"Opisujesz scen\u0119 i l\u0105dujesz w dok\u0142adnej sekundzie filmu","description":"Wyszukiwarka indeksuje rzeczywisty materia\u0142 wideo, nie tytu\u0142y ani nazwy plik\u00F3w. Baza obejmuje oko\u0142o 1300 moment\u00F3w z 14 film\u00F3w i seriali, od \u201EAmerican Psycho\u201D po \u201EBreaking Bad\u201D. Nowy pakiet z YouTube staje si\u0119 przeszukiwalny po jednym poleceniu i 15 minutach.","redditUrl":"/r/SideProject/comments/1vxoziu/i_made_a_search_engine_for_movie_moments_describe/","resourceUrl":null,"subreddit":"sideproject"},{"position":50,"redditPostId":"61df6618-918f-479e-8b7c-9c9dfa701e44","title":"Pracownik Microsoftu wyda\u0142 28 tys. dolar\u00F3w na AI w 28 dni","description":"Mediana za 28 dni wynosi\u0142a oko\u0142o 300 dolar\u00F3w w ca\u0142ej firmie i 975 dolar\u00F3w w CoreAI. Cz\u0119\u015B\u0107 pracownik\u00F3w uprawia\u0142a \u201Etokenmaxxing\u201D: przepala\u0142a tokeny na ma\u0142o warto\u015Bciowe pytania, by pi\u0105\u0107 si\u0119 w wewn\u0119trznych rankingach. EVP Jay Parikh uci\u0105\u0142 to w notatce: \u201ETokenmaxxing nie jest tym, co optymalizujemy\u201D.","redditUrl":"/r/technology/comments/1vzjhzq/one_microsoft_employee_spent_28000_on_ai_in_28/","resourceUrl":"https://www.gadgetreview.com/one-microsoft-employee-spent-28000-on-ai-in-28-days-now-the-company-is-watching-everyone","subreddit":"technology"},{"position":53,"redditPostId":"2bf9279c-dadf-4c5e-9d5c-b670696f8bdb","title":"Nieistniej\u0105cy instytut opublikowa\u0142 124 raporty i 560 tys. s\u0142\u00F3w w dziewi\u0119\u0107 dni","description":"Hanover u\u017Cywa\u0142 platformy Res, by optymalizowa\u0107 quasi-akademickie tre\u015Bci pod chatboty AI. Jedno badanie o antysemickich komentarzach na Facebooku zacytowano 454 razy w 88 raportach. Finansowanie pochodzi\u0142o od izraelskiego rz\u0105du przez Havas Media, a do ameryka\u0144skich firm trafi\u0142o oko\u0142o 24,9 mln dolar\u00F3w.","redditUrl":"/r/technology/comments/1w032v4/fake_us_thinktank_set_up_and_funded_by_israel/","resourceUrl":"https://www.theguardian.com/world/2026/aug/26/fake-thinktank-israel-ai-propaganda","subreddit":"technology"}]}